<?xml version="1.0" encoding="utf-8"?>
<Testtakers xmlns:xsi="http://www.w3.org/2001/XMLSchema-instance" xsi:noNamespaceSchemaLocation="https://raw.githubusercontent.com/iqb-berlin/testcenter/14.3.0/definitions/vo_Testtakers.xsd">

  <Metadata>
    <Description>Check for duplicated login or group names</Description>
  </Metadata>

  <CustomTexts>
    <CustomText key="app_title">TEST TESTCENTER</CustomText>
  </CustomTexts>

  <Group id="group1" label="group1">
    <Login mode="run-demo" name="login1" pw="123">
      <Booklet>CY-Bklt_rundemo</Booklet>
    </Login>
  </Group>

  <Group id="group1" label="group2">
    <Login mode="run-review" name="login2" pw="123">
      <Booklet>CY-Bklt_runreview</Booklet>
    </Login>
  </Group>

</Testtakers>